{
  "schema_version": "policy_translation_confirmation.v1",
  "proposal_id": "policy-translation-proposal-03131ebb6c264b8e21e6cfc250229acec6872632879d1b26193d069f1951b3be",
  "proposal_hash": "sha256:03131ebb6c264b8e21e6cfc250229acec6872632879d1b26193d069f1951b3be",
  "source_snapshot_hash": "sha256:ff5601216d1505cc8d8c9fb73fe3276d3a7852a083f302e8767e592ca1b3727f",
  "authority_ref": "repository-create-only@2.0.0",
  "binding_resolutions": [],
  "control_confirmations": [
    {
      "clause_id": "policy-clause-f7d301eec705aaa85360a4ddcc91d197d96136302e75c1731ed6d8656b683e22",
      "candidate_control_id": "candidate-control-032425c1ae5101f30389f31f2cbf00f74d4717dc553a43668cd756bdf58ebe5d",
      "confirmed_by": "policy-owner",
      "confirmed_at": "2026-09-11T12:01:00Z",
      "confirmation_hash": "sha256:2d874f0dc9bafc33cd4fb4af65c0eca2cc1a8141cf3382d253aab4b90ca20114"
    },
    {
      "clause_id": "policy-clause-2532c0e8dca3a40a13b50b15eb50173c9deb85dae6b33a476b437fa66e5f122e",
      "candidate_control_id": "candidate-control-64b8eedf5747098ba739c3083f900db9b639f81d9f35d9082ae7426ddf0fd9ef",
      "confirmed_by": "policy-owner",
      "confirmed_at": "2026-09-11T12:01:00Z",
      "confirmation_hash": "sha256:316b15e526a98607216c0e311a052289c108567e934dd57fe3f23e01fa04ce37"
    },
    {
      "clause_id": "policy-clause-e9f35596a2e42d45817b4d363668a20e268c145e5e87b758444b6d3a1f2e8743",
      "candidate_control_id": "candidate-control-dfe5ff45ba28b31f7f598cd655c2cb4e4e329f9405aa8b9b22b82defea95154d",
      "confirmed_by": "policy-owner",
      "confirmed_at": "2026-09-11T12:01:00Z",
      "confirmation_hash": "sha256:2bd67037a09536c097981a8468241daf62e1a729f77cb9d7aa862deb3e19f87e"
    }
  ],
  "clause_coverage_decisions": [
    {
      "clause_id": "policy-clause-f7d301eec705aaa85360a4ddcc91d197d96136302e75c1731ed6d8656b683e22",
      "coverage_status": "fully_represented",
      "reason_code": "human-confirmed-complete",
      "human_reason": null,
      "acknowledged_unrepresented": false,
      "confirmed_by": "policy-owner",
      "confirmed_at": "2026-09-11T12:02:00Z",
      "decision_hash": "sha256:0eb542f9fa326fc5787038090658f2f0e446e0fef720824c25c984e8f477903a"
    },
    {
      "clause_id": "policy-clause-2532c0e8dca3a40a13b50b15eb50173c9deb85dae6b33a476b437fa66e5f122e",
      "coverage_status": "fully_represented",
      "reason_code": "human-confirmed-complete",
      "human_reason": null,
      "acknowledged_unrepresented": false,
      "confirmed_by": "policy-owner",
      "confirmed_at": "2026-09-11T12:02:00Z",
      "decision_hash": "sha256:a1ef0728aac5a482b115efb32e920c9c17d71c2d5d7a2c81438da4716e067b35"
    },
    {
      "clause_id": "policy-clause-e9f35596a2e42d45817b4d363668a20e268c145e5e87b758444b6d3a1f2e8743",
      "coverage_status": "fully_represented",
      "reason_code": "human-confirmed-complete",
      "human_reason": null,
      "acknowledged_unrepresented": false,
      "confirmed_by": "policy-owner",
      "confirmed_at": "2026-09-11T12:02:00Z",
      "decision_hash": "sha256:15e0c6212d8d41b98870b0431b3c7ec2e8dcf9ad17ef2d83b91797669cc61e53"
    }
  ],
  "coverage": {
    "total_clause_count": 3,
    "enforced_clause_count": 3,
    "unenforced_clause_count": 0,
    "unresolved_clause_count": 0,
    "fully_represented_clause_count": 3,
    "partially_represented_clause_count": 0,
    "entirely_unsupported_clause_count": 0,
    "informational_clause_count": 0,
    "unrepresented_clause_count": 0,
    "enforced_clause_ids": [
      "policy-clause-2532c0e8dca3a40a13b50b15eb50173c9deb85dae6b33a476b437fa66e5f122e",
      "policy-clause-e9f35596a2e42d45817b4d363668a20e268c145e5e87b758444b6d3a1f2e8743",
      "policy-clause-f7d301eec705aaa85360a4ddcc91d197d96136302e75c1731ed6d8656b683e22"
    ],
    "unenforced_clause_ids": [],
    "acknowledged_unrepresented_clause_ids": [],
    "total_control_count": 3,
    "confirmed_control_count": 3,
    "unresolved_control_count": 0,
    "confirmed_control_ids": [
      "candidate-control-032425c1ae5101f30389f31f2cbf00f74d4717dc553a43668cd756bdf58ebe5d",
      "candidate-control-64b8eedf5747098ba739c3083f900db9b639f81d9f35d9082ae7426ddf0fd9ef",
      "candidate-control-dfe5ff45ba28b31f7f598cd655c2cb4e4e329f9405aa8b9b22b82defea95154d"
    ],
    "unresolved_control_ids": []
  },
  "confirmation_hash": "sha256:e4fce367cb451d1ac0204df094ea63b1c74bbef6553fa1a68d1474a5ac14aae9"
}
